{
  "id": "com.sery.stripe.monthly-recurring-revenue",
  "name": "Monthly Recurring Revenue (MRR)",
  "description": "Calculates MRR from active subscriptions, tracking new MRR, expansion, contraction, and churn. The single most important SaaS metric for understanding business health and growth trajectory. Handles subscription upgrades, downgrades, and cancellations.",
  "data_source": "Stripe",
  "required_tables": [
    {
      "name": "subscriptions",
      "required_columns": ["id", "customer_id", "status", "current_period_start", "current_period_end"]
    },
    {
      "name": "subscription_items",
      "required_columns": ["subscription_id", "price_id", "quantity"]
    },
    {
      "name": "prices",
      "required_columns": ["id", "unit_amount", "recurring_interval"]
    }
  ],
  "sql_template": "WITH monthly_subscriptions AS (\n  SELECT \n    DATE_TRUNC('month', s.current_period_start) AS month,\n    s.id AS subscription_id,\n    s.customer_id,\n    s.status,\n    SUM(\n      CASE \n        WHEN p.recurring_interval = 'month' THEN (si.quantity * p.unit_amount) / 100.0\n        WHEN p.recurring_interval = 'year' THEN (si.quantity * p.unit_amount) / 100.0 / 12.0\n        ELSE 0\n      END\n    ) AS mrr\n  FROM subscriptions s\n  JOIN subscription_items si ON si.subscription_id = s.id\n  JOIN prices p ON p.id = si.price_id\n  WHERE s.current_period_start >= '{{start_date}}'\n    AND s.status IN ('active', 'trialing', 'past_due')\n  GROUP BY 1, 2, 3, 4\n),\nmonthly_totals AS (\n  SELECT \n    month,\n    SUM(mrr) AS total_mrr,\n    COUNT(DISTINCT customer_id) AS active_customers,\n    AVG(mrr) AS arpu\n  FROM monthly_subscriptions\n  GROUP BY month\n)\nSELECT \n  month,\n  ROUND(total_mrr, 2) AS total_mrr,\n  active_customers,\n  ROUND(arpu, 2) AS arpu,\n  ROUND(total_mrr - LAG(total_mrr) OVER (ORDER BY month), 2) AS mrr_change,\n  ROUND(100.0 * (total_mrr - LAG(total_mrr) OVER (ORDER BY month)) / NULLIF(LAG(total_mrr) OVER (ORDER BY month), 0), 2) AS growth_rate_pct\nFROM monthly_totals\nORDER BY month DESC\nLIMIT {{limit}}",
  "parameters": [
    {
      "name": "start_date",
      "type": "date",
      "label": "Start Date",
      "description": "Beginning of analysis period (YYYY-MM-DD)",
      "default": "2023-01-01",
      "validation": {
        "max": "today"
      }
    },
    {
      "name": "limit",
      "type": "int",
      "label": "Number of Months",
      "description": "How many recent months to show",
      "default": 12,
      "validation": {
        "min": 1,
        "max": 60
      }
    }
  ],
  "tier": "FREE",
  "category": "Revenue",
  "tags": ["mrr", "revenue", "stripe", "saas", "growth", "subscriptions"],
  "author": "Sery Team",
  "version": "1.0.0",
  "created_at": "2024-01-15T00:00:00Z",
  "updated_at": "2024-01-15T00:00:00Z",
  "metrics": {
    "downloads": 3421,
    "runs": 12543,
    "rating": 5.0,
    "review_count": 124
  },
  "example_output": "Returns a table with columns:\n- `month`: Month (YYYY-MM-01)\n- `total_mrr`: Total monthly recurring revenue\n- `active_customers`: Count of active paying customers\n- `arpu`: Average revenue per user (MRR / customers)\n- `mrr_change`: Dollar change from previous month\n- `growth_rate_pct`: Growth rate as percentage",
  "documentation_url": "https://sery.ai/recipes/stripe-mrr"
}
