{
  "id": "com.sery.shopify.product-affinity",
  "name": "Product Affinity Analysis",
  "description": "Market basket analysis to discover which products are frequently purchased together. Identifies upsell and cross-sell opportunities, optimal product bundles, and natural product relationships. Uses lift metric to find statistically significant associations beyond random chance.",
  "data_source": "Shopify",
  "required_tables": [
    {
      "name": "order_line_items",
      "required_columns": ["order_id", "product_id", "product_title"]
    }
  ],
  "sql_template": "WITH product_pairs AS (\n  SELECT \n    a.product_id AS product_a_id,\n    a.product_title AS product_a,\n    b.product_id AS product_b_id,\n    b.product_title AS product_b,\n    a.order_id\n  FROM order_line_items a\n  JOIN order_line_items b ON a.order_id = b.order_id AND a.product_id < b.product_id\n  WHERE a.created_at >= '{{start_date}}'\n    AND a.created_at < '{{end_date}}'\n),\ntotal_orders AS (\n  SELECT COUNT(DISTINCT order_id) AS total\n  FROM order_line_items\n  WHERE created_at >= '{{start_date}}'\n    AND created_at < '{{end_date}}'\n),\nproduct_frequencies AS (\n  SELECT \n    product_id,\n    product_title,\n    COUNT(DISTINCT order_id) AS order_count\n  FROM order_line_items\n  WHERE created_at >= '{{start_date}}'\n    AND created_at < '{{end_date}}'\n  GROUP BY product_id, product_title\n),\naffinity_metrics AS (\n  SELECT \n    pp.product_a,\n    pp.product_b,\n    COUNT(DISTINCT pp.order_id) AS co_occurrence_count,\n    pfa.order_count AS product_a_count,\n    pfb.order_count AS product_b_count,\n    to.total AS total_orders,\n    ROUND(100.0 * COUNT(DISTINCT pp.order_id) / to.total, 2) AS support_pct,\n    ROUND(100.0 * COUNT(DISTINCT pp.order_id) / pfa.order_count, 2) AS confidence_a_to_b,\n    ROUND(100.0 * COUNT(DISTINCT pp.order_id) / pfb.order_count, 2) AS confidence_b_to_a,\n    ROUND(\n      (COUNT(DISTINCT pp.order_id)::FLOAT / to.total) / \n      ((pfa.order_count::FLOAT / to.total) * (pfb.order_count::FLOAT / to.total)),\n      2\n    ) AS lift\n  FROM product_pairs pp\n  CROSS JOIN total_orders to\n  JOIN product_frequencies pfa ON pfa.product_id = pp.product_a_id\n  JOIN product_frequencies pfb ON pfb.product_id = pp.product_b_id\n  GROUP BY pp.product_a, pp.product_b, pfa.order_count, pfb.order_count, to.total\n)\nSELECT \n  product_a,\n  product_b,\n  co_occurrence_count AS times_bought_together,\n  support_pct,\n  confidence_a_to_b AS pct_a_buyers_also_buy_b,\n  confidence_b_to_a AS pct_b_buyers_also_buy_a,\n  lift,\n  CASE \n    WHEN lift > 3 THEN 'Very Strong'\n    WHEN lift > 2 THEN 'Strong'\n    WHEN lift > 1.5 THEN 'Moderate'\n    WHEN lift > 1 THEN 'Weak'\n    ELSE 'Negative'\n  END AS affinity_strength\nFROM affinity_metrics\nWHERE lift >= {{min_lift}}\n  AND co_occurrence_count >= {{min_co_occurrence}}\nORDER BY lift DESC, co_occurrence_count DESC\nLIMIT {{limit}}",
  "parameters": [
    {
      "name": "start_date",
      "type": "date",
      "label": "Start Date",
      "description": "Beginning of analysis period (YYYY-MM-DD)",
      "default": "2024-01-01",
      "validation": {
        "max": "today"
      }
    },
    {
      "name": "end_date",
      "type": "date",
      "label": "End Date",
      "description": "End of analysis period (YYYY-MM-DD)",
      "default": "today",
      "validation": {
        "max": "today"
      }
    },
    {
      "name": "min_lift",
      "type": "float",
      "label": "Minimum Lift",
      "description": "Minimum lift score (1.5+ recommended for actionable insights)",
      "default": 1.5,
      "validation": {
        "min": 1.0,
        "max": 10.0
      }
    },
    {
      "name": "min_co_occurrence",
      "type": "int",
      "label": "Minimum Co-Occurrences",
      "description": "Minimum times products must be bought together",
      "default": 10,
      "validation": {
        "min": 1,
        "max": 1000
      }
    },
    {
      "name": "limit",
      "type": "int",
      "label": "Number of Pairs",
      "description": "How many product pairs to show",
      "default": 50,
      "validation": {
        "min": 10,
        "max": 500
      }
    }
  ],
  "tier": "PRO",
  "category": "Product Analytics",
  "tags": ["affinity", "market-basket", "shopify", "cross-sell", "bundles", "recommendations"],
  "author": "Sery Team",
  "version": "1.0.0",
  "created_at": "2024-01-15T00:00:00Z",
  "updated_at": "2024-01-15T00:00:00Z",
  "metrics": {
    "downloads": 654,
    "runs": 1876,
    "rating": 4.8,
    "review_count": 29
  },
  "example_output": "Returns a table with columns:\n- `product_a`: First product name\n- `product_b`: Second product name\n- `times_bought_together`: Number of orders containing both\n- `support_pct`: Percentage of all orders with this pair (0-100)\n- `pct_a_buyers_also_buy_b`: Confidence A→B (% of product A buyers who also buy B)\n- `pct_b_buyers_also_buy_a`: Confidence B→A (% of product B buyers who also buy A)\n- `lift`: Lift score (>1 means positive association, >1.5 actionable)\n- `affinity_strength`: Qualitative strength label\n\nInterpretation:\n- Lift = 1: Products purchased together at random chance rate\n- Lift > 1: Products purchased together more than random\n- Lift = 2: 2x more likely to be purchased together than random\n- Lift > 3: Very strong association, excellent bundle/upsell candidate",
  "documentation_url": "https://sery.ai/recipes/shopify-product-affinity"
}
