{
  "id": "com.sery.shopify.churn-rate",
  "name": "Calculate Monthly Churn Rate",
  "description": "Analyzes customer purchase history to compute monthly churn rate. Identifies customers who made purchases in one month but not the next. Essential for understanding customer retention and predicting revenue.",
  "data_source": "Shopify",
  "required_tables": [
    {
      "name": "orders",
      "required_columns": ["customer_id", "order_date", "total"]
    }
  ],
  "sql_template": "WITH monthly_customers AS (\n  SELECT \n    DATE_TRUNC('month', order_date) AS month,\n    customer_id\n  FROM orders\n  WHERE order_date >= '{{start_date}}'\n    AND total > 0\n  GROUP BY 1, 2\n),\nchurn_analysis AS (\n  SELECT \n    curr.month,\n    COUNT(DISTINCT curr.customer_id) AS active_customers,\n    COUNT(DISTINCT prev.customer_id) AS retained_customers,\n    COUNT(DISTINCT curr.customer_id) - COUNT(DISTINCT prev.customer_id) AS churned_customers\n  FROM monthly_customers curr\n  LEFT JOIN monthly_customers prev \n    ON prev.customer_id = curr.customer_id \n    AND prev.month = DATE_TRUNC('month', curr.month - INTERVAL '1 month')\n  GROUP BY curr.month\n)\nSELECT \n  month,\n  active_customers,\n  retained_customers,\n  churned_customers,\n  ROUND(100.0 * churned_customers / NULLIF(active_customers, 0), 2) AS churn_rate_pct\nFROM churn_analysis\nORDER BY month DESC\nLIMIT {{limit}}",
  "parameters": [
    {
      "name": "start_date",
      "type": "date",
      "label": "Start Date",
      "description": "Beginning of analysis period (YYYY-MM-DD)",
      "default": "2023-01-01",
      "validation": {
        "max": "today"
      }
    },
    {
      "name": "limit",
      "type": "int",
      "label": "Number of Months",
      "description": "How many recent months to show",
      "default": 12,
      "validation": {
        "min": 1,
        "max": 60
      }
    }
  ],
  "tier": "FREE",
  "category": "Customer Analytics",
  "tags": ["churn", "retention", "shopify", "customers", "monthly"],
  "author": "Sery Team",
  "version": "1.0.0",
  "created_at": "2024-01-15T00:00:00Z",
  "updated_at": "2024-01-15T00:00:00Z",
  "metrics": {
    "downloads": 1234,
    "runs": 5678,
    "rating": 4.8,
    "review_count": 42
  },
  "example_output": "Returns a table with columns:\n- `month`: Month (YYYY-MM-01)\n- `active_customers`: Count of customers who ordered this month\n- `retained_customers`: Count of customers who also ordered last month\n- `churned_customers`: Count of customers who ordered last month but not this month\n- `churn_rate_pct`: Churn rate as percentage (0-100)",
  "documentation_url": "https://sery.ai/recipes/shopify-churn-rate"
}
