{
  "id": "com.sery.shopify.top-products",
  "name": "Top Products by Revenue",
  "description": "Analyzes order line items to identify best-selling products by revenue and quantity. Essential for inventory planning, marketing focus, and understanding what drives your business. Groups by product variant to account for size/color differences.",
  "data_source": "Shopify",
  "required_tables": [
    {
      "name": "order_line_items",
      "required_columns": ["product_id", "product_title", "variant_title", "quantity", "price"]
    }
  ],
  "sql_template": "WITH product_performance AS (\n  SELECT \n    product_id,\n    product_title,\n    variant_title,\n    SUM(quantity) AS total_units_sold,\n    SUM(quantity * price) AS total_revenue,\n    COUNT(DISTINCT order_id) AS order_count,\n    AVG(price) AS avg_price\n  FROM order_line_items\n  WHERE created_at >= '{{start_date}}'\n    AND created_at < '{{end_date}}'\n  GROUP BY product_id, product_title, variant_title\n)\nSELECT \n  product_title,\n  variant_title,\n  total_units_sold,\n  ROUND(total_revenue, 2) AS total_revenue,\n  order_count,\n  ROUND(avg_price, 2) AS avg_price,\n  ROUND(100.0 * total_revenue / SUM(total_revenue) OVER (), 2) AS revenue_pct\nFROM product_performance\nORDER BY total_revenue DESC\nLIMIT {{limit}}",
  "parameters": [
    {
      "name": "start_date",
      "type": "date",
      "label": "Start Date",
      "description": "Beginning of analysis period (YYYY-MM-DD)",
      "default": "2024-01-01",
      "validation": {
        "max": "today"
      }
    },
    {
      "name": "end_date",
      "type": "date",
      "label": "End Date",
      "description": "End of analysis period (YYYY-MM-DD)",
      "default": "today",
      "validation": {
        "max": "today"
      }
    },
    {
      "name": "limit",
      "type": "int",
      "label": "Number of Products",
      "description": "How many top products to show",
      "default": 20,
      "validation": {
        "min": 1,
        "max": 100
      }
    }
  ],
  "tier": "FREE",
  "category": "Product Analytics",
  "tags": ["revenue", "products", "shopify", "inventory", "best-sellers"],
  "author": "Sery Team",
  "version": "1.0.0",
  "created_at": "2024-01-15T00:00:00Z",
  "updated_at": "2024-01-15T00:00:00Z",
  "metrics": {
    "downloads": 2341,
    "runs": 8976,
    "rating": 4.9,
    "review_count": 87
  },
  "example_output": "Returns a table with columns:\n- `product_title`: Product name\n- `variant_title`: Variant (size, color, etc.)\n- `total_units_sold`: Number of units sold\n- `total_revenue`: Total revenue from this product\n- `order_count`: Number of orders containing this product\n- `avg_price`: Average price per unit\n- `revenue_pct`: Percentage of total revenue (0-100)",
  "documentation_url": "https://sery.ai/recipes/shopify-top-products"
}
