{
  "id": "com.sery.ga.top-traffic-sources",
  "name": "Top Traffic Sources",
  "description": "Analyzes traffic sources to identify which channels drive the most visitors, sessions, and engagement. Essential for understanding marketing ROI and where to focus acquisition efforts. Breaks down by source/medium (Google/organic, Facebook/cpc, etc.).",
  "data_source": "Google Analytics",
  "required_tables": [
    {
      "name": "sessions",
      "required_columns": ["session_id", "user_id", "source", "medium", "campaign", "session_start", "pageviews", "session_duration"]
    }
  ],
  "sql_template": "WITH source_performance AS (\n  SELECT \n    source,\n    medium,\n    campaign,\n    COUNT(DISTINCT session_id) AS total_sessions,\n    COUNT(DISTINCT user_id) AS unique_users,\n    SUM(pageviews) AS total_pageviews,\n    AVG(pageviews) AS avg_pageviews_per_session,\n    AVG(session_duration) AS avg_session_duration,\n    SUM(CASE WHEN pageviews = 1 THEN 1 ELSE 0 END) AS bounced_sessions\n  FROM sessions\n  WHERE session_start >= '{{start_date}}'\n    AND session_start < '{{end_date}}'\n  GROUP BY source, medium, campaign\n)\nSELECT \n  source,\n  medium,\n  campaign,\n  total_sessions,\n  unique_users,\n  total_pageviews,\n  ROUND(avg_pageviews_per_session, 2) AS avg_pageviews,\n  ROUND(avg_session_duration, 2) AS avg_duration_sec,\n  ROUND(100.0 * bounced_sessions / NULLIF(total_sessions, 0), 2) AS bounce_rate_pct,\n  ROUND(100.0 * total_sessions / SUM(total_sessions) OVER (), 2) AS session_share_pct\nFROM source_performance\nORDER BY total_sessions DESC\nLIMIT {{limit}}",
  "parameters": [
    {
      "name": "start_date",
      "type": "date",
      "label": "Start Date",
      "description": "Beginning of analysis period (YYYY-MM-DD)",
      "default": "2024-01-01",
      "validation": {
        "max": "today"
      }
    },
    {
      "name": "end_date",
      "type": "date",
      "label": "End Date",
      "description": "End of analysis period (YYYY-MM-DD)",
      "default": "today",
      "validation": {
        "max": "today"
      }
    },
    {
      "name": "limit",
      "type": "int",
      "label": "Number of Sources",
      "description": "How many traffic sources to show",
      "default": 20,
      "validation": {
        "min": 1,
        "max": 100
      }
    }
  ],
  "tier": "FREE",
  "category": "Marketing",
  "tags": ["traffic", "google-analytics", "sources", "marketing", "acquisition"],
  "author": "Sery Team",
  "version": "1.0.0",
  "created_at": "2024-01-15T00:00:00Z",
  "updated_at": "2024-01-15T00:00:00Z",
  "metrics": {
    "downloads": 1876,
    "runs": 6234,
    "rating": 4.7,
    "review_count": 53
  },
  "example_output": "Returns a table with columns:\n- `source`: Traffic source (google, facebook, twitter, direct, etc.)\n- `medium`: Medium (organic, cpc, referral, etc.)\n- `campaign`: Campaign name (if applicable)\n- `total_sessions`: Number of sessions from this source\n- `unique_users`: Unique users from this source\n- `total_pageviews`: Total pages viewed\n- `avg_pageviews`: Average pageviews per session\n- `avg_duration_sec`: Average session duration in seconds\n- `bounce_rate_pct`: Percentage of single-page sessions (0-100)\n- `session_share_pct`: Percentage of total traffic (0-100)",
  "documentation_url": "https://sery.ai/recipes/ga-traffic-sources"
}
