{
  "id": "com.sery.csv.time-series-aggregation",
  "name": "Time Series Aggregation",
  "description": "Generic time series analysis pattern for any CSV/Parquet data with a date column. Aggregates numeric values by day, week, or month to identify trends, seasonality, and anomalies. Works with sales data, event logs, metrics, or any time-stamped data.",
  "data_source": "CSV",
  "required_tables": [
    {
      "name": "data",
      "required_columns": []
    }
  ],
  "sql_template": "WITH time_buckets AS (\n  SELECT \n    DATE_TRUNC('{{time_bucket}}', {{date_column}}::DATE) AS period,\n    COUNT(*) AS row_count,\n    SUM({{value_column}}) AS total_value,\n    AVG({{value_column}}) AS avg_value,\n    MIN({{value_column}}) AS min_value,\n    MAX({{value_column}}) AS max_value,\n    STDDEV({{value_column}}) AS stddev_value\n  FROM {{table_name}}\n  WHERE {{date_column}}::DATE >= '{{start_date}}'\n    AND {{date_column}}::DATE < '{{end_date}}'\n  GROUP BY period\n)\nSELECT \n  period,\n  row_count,\n  ROUND(total_value, 2) AS total_value,\n  ROUND(avg_value, 2) AS avg_value,\n  ROUND(min_value, 2) AS min_value,\n  ROUND(max_value, 2) AS max_value,\n  ROUND(stddev_value, 2) AS stddev_value,\n  ROUND(total_value - LAG(total_value) OVER (ORDER BY period), 2) AS change_from_prev,\n  ROUND(100.0 * (total_value - LAG(total_value) OVER (ORDER BY period)) / NULLIF(LAG(total_value) OVER (ORDER BY period), 0), 2) AS pct_change\nFROM time_buckets\nORDER BY period DESC\nLIMIT {{limit}}",
  "parameters": [
    {
      "name": "table_name",
      "type": "string",
      "label": "Table Name",
      "description": "Name of the CSV/Parquet file (without extension)",
      "validation": {
        "pattern": "^[a-zA-Z0-9_-]+$"
      }
    },
    {
      "name": "date_column",
      "type": "string",
      "label": "Date Column",
      "description": "Name of the column containing dates",
      "default": "date",
      "validation": {
        "pattern": "^[a-zA-Z0-9_]+$"
      }
    },
    {
      "name": "value_column",
      "type": "string",
      "label": "Value Column",
      "description": "Name of the numeric column to aggregate",
      "default": "amount",
      "validation": {
        "pattern": "^[a-zA-Z0-9_]+$"
      }
    },
    {
      "name": "time_bucket",
      "type": "string",
      "label": "Time Bucket",
      "description": "Aggregation period: day, week, or month",
      "default": "month",
      "validation": {
        "options": ["day", "week", "month"]
      }
    },
    {
      "name": "start_date",
      "type": "date",
      "label": "Start Date",
      "description": "Beginning of analysis period (YYYY-MM-DD)",
      "default": "2024-01-01",
      "validation": {
        "max": "today"
      }
    },
    {
      "name": "end_date",
      "type": "date",
      "label": "End Date",
      "description": "End of analysis period (YYYY-MM-DD)",
      "default": "today",
      "validation": {
        "max": "today"
      }
    },
    {
      "name": "limit",
      "type": "int",
      "label": "Number of Periods",
      "description": "How many time periods to show",
      "default": 12,
      "validation": {
        "min": 1,
        "max": 365
      }
    }
  ],
  "tier": "FREE",
  "category": "General",
  "tags": ["csv", "time-series", "trends", "aggregation", "generic"],
  "author": "Sery Team",
  "version": "1.0.0",
  "created_at": "2024-01-15T00:00:00Z",
  "updated_at": "2024-01-15T00:00:00Z",
  "metrics": {
    "downloads": 987,
    "runs": 3421,
    "rating": 4.5,
    "review_count": 31
  },
  "example_output": "Returns a table with columns:\n- `period`: Time period (day/week/month start date)\n- `row_count`: Number of records in this period\n- `total_value`: Sum of values in this period\n- `avg_value`: Average value\n- `min_value`: Minimum value\n- `max_value`: Maximum value\n- `stddev_value`: Standard deviation\n- `change_from_prev`: Absolute change from previous period\n- `pct_change`: Percentage change from previous period",
  "documentation_url": "https://sery.ai/recipes/csv-time-series"
}
